{
  "$schema": "https://json-schema.org/draft/2020-12/schema",
  "$id": "/schemas/data/other_funding_sources.schema.json",
  "title": "Other Funding Sources Schema",
  "description": "Schema for validating other funding sources objects used on data.scilifelab.se",
  "type": "array",
  "items": {
    "type": "object",
    "required": [
      "funder",
      "logo",
      "url",
      "alt"
    ],
    "properties": {
      "funder": {
        "type": "string",
        "minLength": 1,
        "description": "Name of the funding organisation or institution."
      },
      "logo": {
        "type": "string",
        "description": "Path to the logo image for the funding organisation.",
        "pattern": "^\\/img\\/funders_logo\\/[^\\s]+\\.png$"
      },
      "url": {
        "type": "string",
        "description": "URL linking to the funding organisation's calls or application information.",
        "pattern": "^https:\\/\\/.+"
      },
      "alt": {
        "type": "string",
        "description": "Alt text for the logo image, typically describing the funding organisation.",
        "pattern": "^Logo for '.+'"
      }
    },
    "additionalProperties": false
  },
  "minItems": 1
}
